product_name,product_type,purchase_price,unit_price,sku,stock_status,current_stock,discount,discount_type,product_images,additional_images,category,sub_category,standard_delivery_time,weight,height,length,width,product_description,meta_tags_description,rating,review_count,seller_name,source_site,source_url,product_id,scraped_at,original_title,variants
ASITVO Wide Mens Barefoot Zero Drop Sole Minimalist Width Toe Box Walking Shoes Sneakers TPU Toe No-Sew Upper,Single Product,29.6,37.0,AMZ-SHO-0018,In Stock,59,0.0,%,['https://m.media-amazon.com/images/I/714eVeaLrRL._AC_UL320_.jpg'],[],Electronics,Smartphones,24 hr(s),0.0,0.0,0.0,0.0,Quality ASITVO Wide Mens Barefoot Zero Drop Sole Minimalist Width Toe Box Walking Shoes Sneakers TPU Toe No-Sew Upper from Amazon with fast shipping and customer support,Buy ASITVO Wide Mens Barefoot Zero Drop Sole Minimalist Width Toe Box Walking Shoes Sneakers TPU Toe No-Sew Upper from Amazon at competitive prices,4.4,337,Amazon,Amazon,https://www.amazon.com/ASITVO-Minimalist-Barefoot-Cross-Trainer-Sneakers/dp/B0D4QDBT97/ref=sr_1_18?dib=eyJ2IjoiMSJ9.ISOjS8ZNz1J8mmiQV_UNNL5wCYH_8PVruBhEACcywLmD7bsUf5zeRsso1J01YiNh6darZDOn12ey7SE-db82_yuVACpNViDZA-rCwje7BS_kjW9zWwHdjYYG9BC22u88xe3PiVsAd78URobYAe_3ZJDjBegtEBO6Hl-92DGG_AzvGnTOQfeOGWSaJ4HraFUMmwLxdtf1Kh2h1NutVq929Vm7rwW80ZYXzge-dM2XzJ-dAx7mSu3hxnupKU1XI3FFiwlvkVGHFG1Dg0w5oPGVtp5CsuDOEUWPurSDPGL5IcA.gm4r84Zx_wWqNUt29VXLI2AoPzxvV6-zgVplO_k7XqI&dib_tag=se&keywords=shoes&qid=1756498211&sr=8-18,amazon_shoes_18,2025-08-30T01:11:45.672516,ASITVO Wide Mens Barefoot Zero Drop Sole Minimalist Width Toe Box Walking Shoes Sneakers TPU Toe No-Sew Upper,[]
Clarks Mens Cosgrove Cap,Single Product,33.6,42.0,AMZ-SHO-0019,In Stock,19,0.0,%,['https://m.media-amazon.com/images/I/71ZMiKmCVoL._AC_UL320_.jpg'],[],Electronics,General,24 hr(s),0.0,0.0,0.0,0.0,Quality Clarks Mens Cosgrove Cap from Amazon with fast shipping and customer support,Buy Clarks Mens Cosgrove Cap from Amazon at competitive prices,4.5,2,Amazon,Amazon,https://www.amazon.com/Clarks-Mens-Cosgrove-Oxford-Leather/dp/B0D8DD63Y8/ref=sr_1_19?dib=eyJ2IjoiMSJ9.ISOjS8ZNz1J8mmiQV_UNNL5wCYH_8PVruBhEACcywLmD7bsUf5zeRsso1J01YiNh6darZDOn12ey7SE-db82_yuVACpNViDZA-rCwje7BS_kjW9zWwHdjYYG9BC22u88xe3PiVsAd78URobYAe_3ZJDjBegtEBO6Hl-92DGG_AzvGnTOQfeOGWSaJ4HraFUMmwLxdtf1Kh2h1NutVq929Vm7rwW80ZYXzge-dM2XzJ-dAx7mSu3hxnupKU1XI3FFiwlvkVGHFG1Dg0w5oPGVtp5CsuDOEUWPurSDPGL5IcA.gm4r84Zx_wWqNUt29VXLI2AoPzxvV6-zgVplO_k7XqI&dib_tag=se&keywords=shoes&qid=1756498211&sr=8-19,amazon_shoes_19,2025-08-30T01:11:50.577116,Clarks Mens Cosgrove Cap,[]
Reebok Womens Club C Extra Platform Sneakers,Single Product,31.2,39.0,AMZ-SHO-0020,In Stock,69,0.0,%,['https://m.media-amazon.com/images/I/71xpFAXjvwL._AC_UL320_.jpg'],[],Electronics,General,24 hr(s),0.0,0.0,0.0,0.0,Quality Reebok Womens Club C Extra Platform Sneakers from Amazon with fast shipping and customer support,Buy Reebok Womens Club C Extra Platform Sneakers from Amazon at competitive prices,4.4,1037,Amazon,Amazon,https://www.amazon.com/Reebok-Womens-Extra-Sneaker-Vector/dp/B09Z7399J2/ref=sr_1_20?dib=eyJ2IjoiMSJ9.ISOjS8ZNz1J8mmiQV_UNNL5wCYH_8PVruBhEACcywLmD7bsUf5zeRsso1J01YiNh6darZDOn12ey7SE-db82_yuVACpNViDZA-rCwje7BS_kjW9zWwHdjYYG9BC22u88xe3PiVsAd78URobYAe_3ZJDjBegtEBO6Hl-92DGG_AzvGnTOQfeOGWSaJ4HraFUMmwLxdtf1Kh2h1NutVq929Vm7rwW80ZYXzge-dM2XzJ-dAx7mSu3hxnupKU1XI3FFiwlvkVGHFG1Dg0w5oPGVtp5CsuDOEUWPurSDPGL5IcA.gm4r84Zx_wWqNUt29VXLI2AoPzxvV6-zgVplO_k7XqI&dib_tag=se&keywords=shoes&qid=1756498211&sr=8-20,amazon_shoes_20,2025-08-30T01:11:57.854495,Reebok Womens Club C Extra Platform Sneakers,[]
Skechers Mens Summits AT Hands Free Slip-in Sneaker,Single Product,36.0,45.0,AMZ-SHO-0021,In Stock,83,0.0,%,['https://m.media-amazon.com/images/I/81y0QPFDghL._AC_UL320_.jpg'],[],Electronics,General,24 hr(s),0.0,0.0,0.0,0.0,Quality Skechers Mens Summits AT Hands Free Slip-in Sneaker from Amazon with fast shipping and customer support,Buy Skechers Mens Summits AT Hands Free Slip-in Sneaker from Amazon at competitive prices,4.6,2866,Amazon,Amazon,https://www.amazon.com/Skechers-Summits-Hands-Sneaker-Orange/dp/B0CFCJX52X/ref=sr_1_21?dib=eyJ2IjoiMSJ9.ISOjS8ZNz1J8mmiQV_UNNL5wCYH_8PVruBhEACcywLmD7bsUf5zeRsso1J01YiNh6darZDOn12ey7SE-db82_yuVACpNViDZA-rCwje7BS_kjW9zWwHdjYYG9BC22u88xe3PiVsAd78URobYAe_3ZJDjBegtEBO6Hl-92DGG_AzvGnTOQfeOGWSaJ4HraFUMmwLxdtf1Kh2h1NutVq929Vm7rwW80ZYXzge-dM2XzJ-dAx7mSu3hxnupKU1XI3FFiwlvkVGHFG1Dg0w5oPGVtp5CsuDOEUWPurSDPGL5IcA.gm4r84Zx_wWqNUt29VXLI2AoPzxvV6-zgVplO_k7XqI&dib_tag=se&keywords=shoes&qid=1756498211&sr=8-21,amazon_shoes_21,2025-08-30T01:12:05.193817,Skechers Mens Summits AT Hands Free Slip-in Sneaker,[]
Mens Running Shoes Fashion Sneakers Tennis Walking Shoes Lightweight Athletic Gym Workout Shoes,Single Product,16.8,21.0,AMZ-SHO-0022,In Stock,14,0.0,%,['https://m.media-amazon.com/images/I/713emNn84TL._AC_UL320_.jpg'],[],Fashion,Shoes,24 hr(s),0.0,0.0,0.0,0.0,Quality Mens Running Shoes Fashion Sneakers Tennis Walking Shoes Lightweight Athletic Gym Workout Shoes from Amazon with fast shipping and customer support,Buy Mens Running Shoes Fashion Sneakers Tennis Walking Shoes Lightweight Athletic Gym Workout Shoes from Amazon at competitive prices,4.0,758,Amazon,Amazon,https://www.amazon.com/YITUHIO-Running-Shoes-Sneakers-Lightweight/dp/B0D1B42GVJ/ref=sr_1_22?dib=eyJ2IjoiMSJ9.ISOjS8ZNz1J8mmiQV_UNNL5wCYH_8PVruBhEACcywLmD7bsUf5zeRsso1J01YiNh6darZDOn12ey7SE-db82_yuVACpNViDZA-rCwje7BS_kjW9zWwHdjYYG9BC22u88xe3PiVsAd78URobYAe_3ZJDjBegtEBO6Hl-92DGG_AzvGnTOQfeOGWSaJ4HraFUMmwLxdtf1Kh2h1NutVq929Vm7rwW80ZYXzge-dM2XzJ-dAx7mSu3hxnupKU1XI3FFiwlvkVGHFG1Dg0w5oPGVtp5CsuDOEUWPurSDPGL5IcA.gm4r84Zx_wWqNUt29VXLI2AoPzxvV6-zgVplO_k7XqI&dib_tag=se&keywords=shoes&qid=1756498211&sr=8-22,amazon_shoes_22,2025-08-30T01:12:10.563017,Mens Running Shoes Fashion Sneakers Tennis Walking Shoes Lightweight Athletic Gym Workout Shoes,[]
Under Armour Unisex-Child Grade School Lockdown 7 Sneaker,Single Product,31.2,39.0,AMZ-SHO-0023,In Stock,79,0.0,%,['https://m.media-amazon.com/images/I/51etObPYHLL._AC_UL320_.jpg'],[],Electronics,General,24 hr(s),0.0,0.0,0.0,0.0,Quality Under Armour Unisex-Child Grade School Lockdown 7 Sneaker from Amazon with fast shipping and customer support,Buy Under Armour Unisex-Child Grade School Lockdown 7 Sneaker from Amazon at competitive prices,4.6,937,Amazon,Amazon,https://www.amazon.com/Under-Armour-Unisex-Lockdown-Metallic/dp/B0CJT8WV7J/ref=sr_1_23?dib=eyJ2IjoiMSJ9.ISOjS8ZNz1J8mmiQV_UNNL5wCYH_8PVruBhEACcywLmD7bsUf5zeRsso1J01YiNh6darZDOn12ey7SE-db82_yuVACpNViDZA-rCwje7BS_kjW9zWwHdjYYG9BC22u88xe3PiVsAd78URobYAe_3ZJDjBegtEBO6Hl-92DGG_AzvGnTOQfeOGWSaJ4HraFUMmwLxdtf1Kh2h1NutVq929Vm7rwW80ZYXzge-dM2XzJ-dAx7mSu3hxnupKU1XI3FFiwlvkVGHFG1Dg0w5oPGVtp5CsuDOEUWPurSDPGL5IcA.gm4r84Zx_wWqNUt29VXLI2AoPzxvV6-zgVplO_k7XqI&dib_tag=se&keywords=shoes&qid=1756498211&sr=8-23,amazon_shoes_23,2025-08-30T01:12:16.848890,Under Armour Unisex-Child Grade School Lockdown 7 Sneaker,[]
Project Cloud Platform Sneakers for Women - Lightweight Memory Foam Insole Womens Sneakers - Non-Slip Fashion Sneakers for Women Footwear - Womens Fashion Platform Shoes (Nita),Single Product,35.2,44.0,AMZ-SHO-0024,In Stock,37,0.0,%,['https://m.media-amazon.com/images/I/71vchIYFF5L._AC_UL320_.jpg'],[],Fashion,Shoes,24 hr(s),0.0,0.0,0.0,0.0,Quality Project Cloud Platform Sneakers for Women - Lightweight Memory Foam Insole Womens Sneakers - Non-Slip Fashion Sneakers for Women Footwear - Womens Fashion Platform Shoes (Nita) from Amazon with fast shipping and customer support,Buy Project Cloud Platform Sneakers for Women - Lightweight Memory Foam Insole Womens Sneakers - Non-Slip Fashion Sneakers for Women Footwear - Womens Fashion Platform Shoes (Nita) from Amazon at competitive prices,4.2,922,Amazon,Amazon,https://www.amazon.com/Project-Cloud-Sneakers-Women-Lightweight/dp/B0D5RM3J3X/ref=sr_1_24?dib=eyJ2IjoiMSJ9.ISOjS8ZNz1J8mmiQV_UNNL5wCYH_8PVruBhEACcywLmD7bsUf5zeRsso1J01YiNh6darZDOn12ey7SE-db82_yuVACpNViDZA-rCwje7BS_kjW9zWwHdjYYG9BC22u88xe3PiVsAd78URobYAe_3ZJDjBegtEBO6Hl-92DGG_AzvGnTOQfeOGWSaJ4HraFUMmwLxdtf1Kh2h1NutVq929Vm7rwW80ZYXzge-dM2XzJ-dAx7mSu3hxnupKU1XI3FFiwlvkVGHFG1Dg0w5oPGVtp5CsuDOEUWPurSDPGL5IcA.gm4r84Zx_wWqNUt29VXLI2AoPzxvV6-zgVplO_k7XqI&dib_tag=se&keywords=shoes&qid=1756498211&sr=8-24,amazon_shoes_24,2025-08-30T01:12:21.633601,Project Cloud Platform Sneakers for Women - Lightweight Memory Foam Insole Womens Sneakers - Non-Slip Fashion Sneakers for Women Footwear - Womens Fashion Platform Shoes (Nita),[]
On Mens Cloudrunner 2 Sneakers,Single Product,127.2,159.0,AMZ-SHO-0025,In Stock,17,0.0,%,['https://m.media-amazon.com/images/I/71Vu8A5lFzL._AC_UL320_.jpg'],[],Electronics,General,24 hr(s),0.0,0.0,0.0,0.0,Quality On Mens Cloudrunner 2 Sneakers from Amazon with fast shipping and customer support,Buy On Mens Cloudrunner 2 Sneakers from Amazon at competitive prices,4.6,198,Amazon,Amazon,https://www.amazon.com/Mens-Cloudrunner-Frost-White-Medium/dp/B0C5QJXK2N/ref=sr_1_25?dib=eyJ2IjoiMSJ9.ISOjS8ZNz1J8mmiQV_UNNL5wCYH_8PVruBhEACcywLmD7bsUf5zeRsso1J01YiNh6darZDOn12ey7SE-db82_yuVACpNViDZA-rCwje7BS_kjW9zWwHdjYYG9BC22u88xe3PiVsAd78URobYAe_3ZJDjBegtEBO6Hl-92DGG_AzvGnTOQfeOGWSaJ4HraFUMmwLxdtf1Kh2h1NutVq929Vm7rwW80ZYXzge-dM2XzJ-dAx7mSu3hxnupKU1XI3FFiwlvkVGHFG1Dg0w5oPGVtp5CsuDOEUWPurSDPGL5IcA.gm4r84Zx_wWqNUt29VXLI2AoPzxvV6-zgVplO_k7XqI&dib_tag=se&keywords=shoes&qid=1756498211&sr=8-25,amazon_shoes_25,2025-08-30T01:12:28.211186,On Mens Cloudrunner 2 Sneakers,[]
FEETCITY Baby Boys Girls First Walking Shoes Infant Sneakers Crib Shoes Breathable Lightweight Slip On Shoes,Single Product,3.6,4.5,AMZ-SHO-0026,In Stock,92,0.0,%,['https://m.media-amazon.com/images/I/71SoKGEzt0L._AC_UL320_.jpg'],[],Fashion,Shoes,24 hr(s),0.0,0.0,0.0,0.0,Quality FEETCITY Baby Boys Girls First Walking Shoes Infant Sneakers Crib Shoes Breathable Lightweight Slip On Shoes from Amazon with fast shipping and customer support,Buy FEETCITY Baby Boys Girls First Walking Shoes Infant Sneakers Crib Shoes Breathable Lightweight Slip On Shoes from Amazon at competitive prices,4.5,1774,Amazon,Amazon,https://www.amazon.com/FEETCITY-Walking-Toddler-Sneakers-Anti-Slip/dp/B0CD3C7JZG/ref=sr_1_26?dib=eyJ2IjoiMSJ9.ISOjS8ZNz1J8mmiQV_UNNL5wCYH_8PVruBhEACcywLmD7bsUf5zeRsso1J01YiNh6darZDOn12ey7SE-db82_yuVACpNViDZA-rCwje7BS_kjW9zWwHdjYYG9BC22u88xe3PiVsAd78URobYAe_3ZJDjBegtEBO6Hl-92DGG_AzvGnTOQfeOGWSaJ4HraFUMmwLxdtf1Kh2h1NutVq929Vm7rwW80ZYXzge-dM2XzJ-dAx7mSu3hxnupKU1XI3FFiwlvkVGHFG1Dg0w5oPGVtp5CsuDOEUWPurSDPGL5IcA.gm4r84Zx_wWqNUt29VXLI2AoPzxvV6-zgVplO_k7XqI&dib_tag=se&keywords=shoes&qid=1756498211&sr=8-26,amazon_shoes_26,2025-08-30T01:12:34.133125,FEETCITY Baby Boys Girls First Walking Shoes Infant Sneakers Crib Shoes Breathable Lightweight Slip On Shoes,[]
Under Armour Womens Charged Assert 10 Shoes,Single Product,60.0,75.0,AMZ-SHO-0027,In Stock,81,0.0,%,['https://m.media-amazon.com/images/I/51sc6uMmE-L._AC_UL320_.jpg'],[],Fashion,Shoes,24 hr(s),0.0,0.0,0.0,0.0,Quality Under Armour Womens Charged Assert 10 Shoes from Amazon with fast shipping and customer support,Buy Under Armour Womens Charged Assert 10 Shoes from Amazon at competitive prices,4.3,5338,Amazon,Amazon,https://www.amazon.com/Under-Armour-Womens-Charged-Running/dp/B09XBVQGPS/ref=sr_1_27?dib=eyJ2IjoiMSJ9.ISOjS8ZNz1J8mmiQV_UNNL5wCYH_8PVruBhEACcywLmD7bsUf5zeRsso1J01YiNh6darZDOn12ey7SE-db82_yuVACpNViDZA-rCwje7BS_kjW9zWwHdjYYG9BC22u88xe3PiVsAd78URobYAe_3ZJDjBegtEBO6Hl-92DGG_AzvGnTOQfeOGWSaJ4HraFUMmwLxdtf1Kh2h1NutVq929Vm7rwW80ZYXzge-dM2XzJ-dAx7mSu3hxnupKU1XI3FFiwlvkVGHFG1Dg0w5oPGVtp5CsuDOEUWPurSDPGL5IcA.gm4r84Zx_wWqNUt29VXLI2AoPzxvV6-zgVplO_k7XqI&dib_tag=se&keywords=shoes&qid=1756498211&sr=8-27,amazon_shoes_27,2025-08-30T01:12:41.500633,Under Armour Womens Charged Assert 10 Shoes,[]
Under Armour Womens Charged Surge 4 Running Shoe,Single Product,44.0,55.0,AMZ-SHO-0028,In Stock,59,0.0,%,['https://m.media-amazon.com/images/I/71aIkkGBjvL._AC_UL320_.jpg'],[],Sports,Running,24 hr(s),0.0,0.0,0.0,0.0,Quality Under Armour Womens Charged Surge 4 Running Shoe from Amazon with fast shipping and customer support,Buy Under Armour Womens Charged Surge 4 Running Shoe from Amazon at competitive prices,4.4,2814,Amazon,Amazon,https://www.amazon.com/Under-Armour-Charged-Running-Metallic/dp/B0BZXGSLZ8/ref=sr_1_28?dib=eyJ2IjoiMSJ9.ISOjS8ZNz1J8mmiQV_UNNL5wCYH_8PVruBhEACcywLmD7bsUf5zeRsso1J01YiNh6darZDOn12ey7SE-db82_yuVACpNViDZA-rCwje7BS_kjW9zWwHdjYYG9BC22u88xe3PiVsAd78URobYAe_3ZJDjBegtEBO6Hl-92DGG_AzvGnTOQfeOGWSaJ4HraFUMmwLxdtf1Kh2h1NutVq929Vm7rwW80ZYXzge-dM2XzJ-dAx7mSu3hxnupKU1XI3FFiwlvkVGHFG1Dg0w5oPGVtp5CsuDOEUWPurSDPGL5IcA.gm4r84Zx_wWqNUt29VXLI2AoPzxvV6-zgVplO_k7XqI&dib_tag=se&keywords=shoes&qid=1756498211&sr=8-28,amazon_shoes_28,2025-08-30T01:12:46.246104,Under Armour Womens Charged Surge 4 Running Shoe,[]
hash bubbie Womens Slip on Shoes Canvas Shoes Non Slip Fashion Sneakers for Women Low Top Loafers,Single Product,18.4,23.0,AMZ-SHO-0029,In Stock,39,0.0,%,['https://m.media-amazon.com/images/I/717bQXEflpL._AC_UL320_.jpg'],[],Fashion,Shoes,24 hr(s),0.0,0.0,0.0,0.0,Quality hash bubbie Womens Slip on Shoes Canvas Shoes Non Slip Fashion Sneakers for Women Low Top Loafers from Amazon with fast shipping and customer support,Buy hash bubbie Womens Slip on Shoes Canvas Shoes Non Slip Fashion Sneakers for Women Low Top Loafers from Amazon at competitive prices,4.0,617,Amazon,Amazon,https://www.amazon.com/hash-bubbie-Fashion-Sneakers-Loafers%EF%BC%88Biege-US7%EF%BC%89/dp/B0CZRLCMX1/ref=sr_1_29?dib=eyJ2IjoiMSJ9.ISOjS8ZNz1J8mmiQV_UNNL5wCYH_8PVruBhEACcywLmD7bsUf5zeRsso1J01YiNh6darZDOn12ey7SE-db82_yuVACpNViDZA-rCwje7BS_kjW9zWwHdjYYG9BC22u88xe3PiVsAd78URobYAe_3ZJDjBegtEBO6Hl-92DGG_AzvGnTOQfeOGWSaJ4HraFUMmwLxdtf1Kh2h1NutVq929Vm7rwW80ZYXzge-dM2XzJ-dAx7mSu3hxnupKU1XI3FFiwlvkVGHFG1Dg0w5oPGVtp5CsuDOEUWPurSDPGL5IcA.gm4r84Zx_wWqNUt29VXLI2AoPzxvV6-zgVplO_k7XqI&dib_tag=se&keywords=shoes&qid=1756498211&sr=8-29,amazon_shoes_29,2025-08-30T01:12:54.344211,hash bubbie Womens Slip on Shoes Canvas Shoes Non Slip Fashion Sneakers for Women Low Top Loafers,[]
Abboos Womens Slip On Sneakers Women Walking Tennis Shoes Lightweight Casual Sneakers for Gym Travel Work,Single Product,18.4,23.0,AMZ-SHO-0030,In Stock,57,0.0,%,['https://m.media-amazon.com/images/I/71WEWMEG5UL._AC_UL320_.jpg'],[],Fashion,Shoes,24 hr(s),0.0,0.0,0.0,0.0,Quality Abboos Womens Slip On Sneakers Women Walking Tennis Shoes Lightweight Casual Sneakers for Gym Travel Work from Amazon with fast shipping and customer support,Buy Abboos Womens Slip On Sneakers Women Walking Tennis Shoes Lightweight Casual Sneakers for Gym Travel Work from Amazon at competitive prices,4.3,7556,Amazon,Amazon,https://www.amazon.com/Abboos-Walking-Comfortable-Sneakers-Sapphire/dp/B0BFW2PTQ3/ref=sr_1_30?dib=eyJ2IjoiMSJ9.ISOjS8ZNz1J8mmiQV_UNNL5wCYH_8PVruBhEACcywLmD7bsUf5zeRsso1J01YiNh6darZDOn12ey7SE-db82_yuVACpNViDZA-rCwje7BS_kjW9zWwHdjYYG9BC22u88xe3PiVsAd78URobYAe_3ZJDjBegtEBO6Hl-92DGG_AzvGnTOQfeOGWSaJ4HraFUMmwLxdtf1Kh2h1NutVq929Vm7rwW80ZYXzge-dM2XzJ-dAx7mSu3hxnupKU1XI3FFiwlvkVGHFG1Dg0w5oPGVtp5CsuDOEUWPurSDPGL5IcA.gm4r84Zx_wWqNUt29VXLI2AoPzxvV6-zgVplO_k7XqI&dib_tag=se&keywords=shoes&qid=1756498211&sr=8-30,amazon_shoes_30,2025-08-30T01:13:01.893468,Abboos Womens Slip On Sneakers Women Walking Tennis Shoes Lightweight Casual Sneakers for Gym Travel Work,[]
"Galaxy S25 Ultra, 512GB Smartphone, Unlocked Android, AI Night Mode Camera, Snapdragon 8 Elite Fast Processor, 5000mAh Battery, Built-in S Pen, 2025, US 1 Yr Warranty, Titanium Black",Single Product,3.2,4.0,AMZ-SAM-0001,In Stock,53,0.0,%,['https://m.media-amazon.com/images/I/61n0lmxP5-L._AC_UY218_.jpg'],[],Electronics,Smartphones,24 hr(s),0.0,0.0,0.0,0.0,"Quality Galaxy S25 Ultra, 512GB Smartphone, Unlocked Android, AI Night Mode Camera, Snapdragon 8 Elite Fast Processor, 5000mAh Battery, Built-in S Pen, 2025, US 1 Yr Warranty, Titanium Black from Amazon with fast shipping and customer support","Buy Galaxy S25 Ultra, 512GB Smartphone, Unlocked Android, AI Night Mode Camera, Snapdragon 8 Elite Fast Processor, 5000mAh Battery, Built-in S Pen, 2025, US 1 Yr Warranty, Titanium Black from Amazon at competitive prices",4.5,132,Amazon,Amazon,https://www.amazon.com/Smartphone-Unlocked-Processor-Manufacturer-Warranty/dp/B0DP3G4GVQ/ref=sr_1_1?dib=eyJ2IjoiMSJ9.lQDR9PcYOf13hE-4sat7ZBvt-Wsj2cvGPeyNzZjDXmV7cXMLiPqTETTV2K1zqvzRPF6j8yLXrnUSasPeLPr89F8Nsg00E0VcK0Z7m9Yb267Coi1u8VeNQnWowbbSb9TUB41ucgR1fiPxZK40a64r9WMaKo90Bxrs40flpeFhKjqHy2KF9Ua9d33O1egW1NjDqfISH6vFvq_1aMCmW-9caO6ZZ7MOSR-j6yjWejRGXtI.lYLHS825pZlScbBWZi5KdJ7ruzutm-l5LwPkUYDVh0Q&dib_tag=se&keywords=samsung&qid=1756498402&sr=8-1,amazon_samsung_1,2025-08-30T01:13:24.510056,"Galaxy S25 Ultra, 512GB Smartphone, Unlocked Android, AI Night Mode Camera, Snapdragon 8 Elite Fast Processor, 5000mAh Battery, Built-in S Pen, 2025, US 1 Yr Warranty, Titanium Black","[{'storage': '64GB', 'price': 163.73, 'stock': 5, 'sku': 'STORAGE-64GB'}, {'storage': '128GB', 'price': 165.3, 'stock': 7, 'sku': 'STORAGE-128GB'}, {'storage': '256GB', 'price': 165.3, 'stock': 24, 'sku': 'STORAGE-256GB'}]"
"Galaxy A16 4G LTE (128GB  4GB) International Model SM-A165FDS Factory Unlocked, 6.7, Dual SIM, 50MP Triple Camera (Case Bundle), Black",Single Product,104.0,130.0,AMZ-SAM-0002,In Stock,82,0.0,%,['https://m.media-amazon.com/images/I/61Lp1UcxeLL._AC_UY218_.jpg'],[],Electronics,Smartphones,24 hr(s),0.0,0.0,0.0,0.0,"Quality Galaxy A16 4G LTE (128GB  4GB) International Model SM-A165FDS Factory Unlocked, 6.7, Dual SIM, 50MP Triple Camera (Case Bundle), Black from Amazon with fast shipping and customer support","Buy Galaxy A16 4G LTE (128GB  4GB) International Model SM-A165FDS Factory Unlocked, 6.7, Dual SIM, 50MP Triple Camera (Case Bundle), Black from Amazon at competitive prices",3.9,1322,Amazon,Amazon,https://www.amazon.com/Samsung-International-SM-A165F-Factory-Unlocked/dp/B0DM1S54MZ/ref=sr_1_2?dib=eyJ2IjoiMSJ9.lQDR9PcYOf13hE-4sat7ZBvt-Wsj2cvGPeyNzZjDXmV7cXMLiPqTETTV2K1zqvzRPF6j8yLXrnUSasPeLPr89F8Nsg00E0VcK0Z7m9Yb267Coi1u8VeNQnWowbbSb9TUB41ucgR1fiPxZK40a64r9WMaKo90Bxrs40flpeFhKjqHy2KF9Ua9d33O1egW1NjDqfISH6vFvq_1aMCmW-9caO6ZZ7MOSR-j6yjWejRGXtI.lYLHS825pZlScbBWZi5KdJ7ruzutm-l5LwPkUYDVh0Q&dib_tag=se&keywords=samsung&qid=1756498402&sr=8-2,amazon_samsung_2,2025-08-30T01:13:28.116165,"Galaxy A16 4G LTE (128GB  4GB) International Model SM-A165FDS Factory Unlocked, 6.7, Dual SIM, 50MP Triple Camera (Case Bundle), Black",[]
